[
  {
    "schemaVersion": "1.0",
    "requestedCaseNumber": "C01-7K4M2Q-0702-1000",
    "outcome": "FOUND",
    "case": {
      "caseNumber": "C01-7K4M2Q-0702-1000",
      "caseType": "GENERAL",
      "status": "OPEN",
      "visibility": "COURSE",
      "publicSummary": "This fictional case is open and has a teaching-team reply.",
      "updatedAt": "2026-07-02T10:12:00+08:00"
    },
    "lookedUpAt": "2026-07-03T12:10:00+08:00"
  },
  {
    "schemaVersion": "1.0",
    "requestedCaseNumber": "C01-Z9Y8X7-0702-2359",
    "outcome": "NOT_FOUND",
    "case": null,
    "lookedUpAt": "2026-07-03T12:11:00+08:00"
  }
]
