{
  "schemaVersion": "1.0",
  "requestedCaseNumber": "C01-7K4M2Q-0702-1000",
  "outcome": "FOUND",
  "case": {
    "caseNumber": "C01-7K4M2Q-0702-1000",
    "caseType": "GENERAL",
    "status": "OPEN",
    "visibility": "COURSE",
    "publicSummary": "This fictional case is waiting for a teaching-team response.",
    "updatedAt": "2026-07-02T10:00:00+08:00"
  },
  "lookedUpAt": "2026-07-03T12:10:00+08:00"
}
